{
  "$schema": "http://json-schema.org/draft-07/schema#",
  "type": "object",
  "properties": {
    "name": { "type": "string", "minLength": 3 },
    "description": { "type": "string", "minLength": 10 },
    "version": { "type": "string", "pattern": "^\\d+\\.\\d+\\.\\d+$" },
    "author": { "type": "string" },
    "manifestUrl": { "type": "string", "format": "uri" },
    "homepageUrl": { "type": "string", "format": "uri" },
    "tags": { "type": "array", "items": { "type": "string" } },
    "createdAt": { "type": "string", "format": "date-time" }
  },
  "required": ["name", "description", "version", "author", "manifestUrl"]
}
