{
  "name": "PDF Assistant",
  "description": "Official Anthropic skill for generating, manipulating, and analyzing PDF files.",
  "version": "1.0.0",
  "author": "Anthropic",
  "manifestUrl": "https://raw.githubusercontent.com/anthropics/skills/main/skills/pdf/SKILL.md",
  "homepageUrl": "https://github.com/anthropics/skills/tree/main/skills/pdf",
  "tags": ["pdf", "documents", "office"],
  "createdAt": "2026-04-02T15:35:00Z"
}
