{
  "name": "Excel (XLSX) Pro",
  "description": "Official Anthropic skill for creating and managing complex Excel spreadsheets and data analysis.",
  "version": "1.0.0",
  "author": "Anthropic",
  "manifestUrl": "https://raw.githubusercontent.com/anthropics/skills/main/skills/xlsx/SKILL.md",
  "homepageUrl": "https://github.com/anthropics/skills/tree/main/skills/xlsx",
  "tags": ["excel", "data", "office"],
  "createdAt": "2026-04-02T15:45:00Z"
}
